{
  "corners": [],
  "deck_overrides": {},
  "deterministic_seed": 0,
  "generated_from": {
    "script": "render_v4_harness.py",
    "version": "v4-harness-renderer-v1"
  },
  "harness_spec_sha256": "cd0a3e94a48e505a13f66eb6896996516a766283d0c3b0d1fb26cb465425c598",
  "parameters": {
    "maxstep": "200p",
    "stop_time": "102n"
  },
  "profile_name": "feedback",
  "property_ids": [
    "P_ON_RESET_OR_WHEN_ENABLE_IS",
    "P_ON_EACH_RISING_CLK_EDGE_WHILE",
    "P_COMPUTE_A_FIRST_STAGE_METRIC_FROM",
    "P_COMPUTE_AN_OUTPUT_TARGET_FROM_THE",
    "P_CLAMP_THE_OUTPUT_TARGET_TO_VSS",
    "P_MOVE_VOUT_TOWARD_THE_CLAMPED_TARGET",
    "P_ASSERT_SETTLED_ONLY_AFTER_TWO_CONSECUTIVE_UPDATES"
  ],
  "public_visible": true,
  "schema_version": "v4-harness-profile-v1",
  "simulatorOptions": {
    "evas_profile": "balanced"
  }
}
