{
  "corners": [],
  "deck_overrides": {
    "body_lines": [
      "Vdd (vdd 0) vsource dc=1.0",
      "Vgnd (gnd 0) vsource dc=0",
      "Vb0 (b0 0) vsource type=pwl wave=[0 1.0 0.8n 1.0 0.85n 0 2.4n 0 2.45n 1.0 3.9n 1.0]",
      "Vb1 (b1 0) vsource type=pwl wave=[0 1.0 0.8n 1.0 0.85n 0 1.6n 0 1.65n 1.0 2.4n 1.0 2.45n 0 3.2n 0 3.25n 1.0 3.9n 1.0]",
      "XDUT (vdd gnd b1 b0 t0 t1 t2) bin2ther_2b"
    ]
  },
  "deterministic_seed": 0,
  "generated_from": {
    "script": "render_v4_harness.py",
    "version": "v4-harness-renderer-v1"
  },
  "harness_spec_sha256": "696f96a6994907b5b9d9bafef0d3ea606b6357b05d7fcf62c41188dd6a3d934c",
  "parameters": {
    "maxstep": "100p",
    "stop_time": "100n"
  },
  "profile_name": "score",
  "property_ids": [
    "P_INTERPRET_B1_AND_B0_RELATIVE_TO",
    "P_DRIVE_T0_AND_T1_HIGH_TOGETHER",
    "P_DRIVE_T2_HIGH_WHEN_B0_IS",
    "P_DRIVE_EACH_LOW_OUTPUT_TO_THE"
  ],
  "public_visible": false,
  "schema_version": "v4-harness-profile-v1",
  "simulatorOptions": {}
}
