{
  "corners": [],
  "deck_overrides": {},
  "deterministic_seed": 0,
  "generated_from": {
    "script": "render_v4_harness.py",
    "version": "v4-harness-renderer-v1"
  },
  "harness_spec_sha256": "1ea6ebc74318ff5505a0a9cc89782202ba371364bb20f70ff8aad0c620608b93",
  "parameters": {},
  "profile_name": "score",
  "property_ids": [
    "P_POSITIVE_LO_GAIN_PATH",
    "P_NEGATIVE_LO_CHOP_PATH",
    "P_CONTINUOUS_TRACKING"
  ],
  "public_visible": false,
  "schema_version": "v4-harness-profile-v1",
  "simulatorOptions": {}
}
