{
  "corners": [],
  "deck_overrides": {},
  "deterministic_seed": 0,
  "generated_from": {
    "script": "render_v4_harness.py",
    "version": "v4-harness-renderer-v1"
  },
  "harness_spec_sha256": "8c0a50c0fea8ab7e5f5888aed0b0068010f2e78ee752015b4556ff82dbff63d5",
  "parameters": {},
  "profile_name": "feedback",
  "property_ids": [
    "P_INPUT_SAMPLE",
    "P_S6_HALF_ADD",
    "P_BINARY_SUBTRACTIONS",
    "P_EDGE_POLARITY",
    "P_ACCUMULATED_STATE",
    "P_OUTPUT_TRANSITION"
  ],
  "public_visible": true,
  "schema_version": "v4-harness-profile-v1",
  "simulatorOptions": {
    "evas_profile": "balanced"
  }
}
