{
  "corners": [],
  "deck_overrides": {},
  "deterministic_seed": 0,
  "generated_from": {
    "script": "render_v4_harness.py",
    "version": "v4-harness-renderer-v1"
  },
  "harness_spec_sha256": "7aaf54b58e0f6aca39b8b2082c710484945b22b7880c8700b9eae829bddb9380",
  "parameters": {},
  "profile_name": "feedback",
  "property_ids": [
    "P_START_ARMS",
    "P_NEXT_STOP_COMPLETES",
    "P_INTERVAL_QUANTIZATION",
    "P_CODE_SATURATION",
    "P_VALID_AND_BIT_ORDER"
  ],
  "public_visible": true,
  "schema_version": "v4-harness-profile-v1",
  "simulatorOptions": {
    "evas_profile": "balanced"
  }
}
