{
  "corners": [],
  "deck_overrides": {},
  "deterministic_seed": 0,
  "generated_from": {
    "script": "render_v4_harness.py",
    "version": "v4-harness-renderer-v1"
  },
  "harness_spec_sha256": "117d417928af312cb2e7a755bf7243e04fa0f12c8d80fba7a122e569890c06dd",
  "parameters": {
    "maxstep": "100p",
    "stop_time": "100n"
  },
  "profile_name": "score",
  "property_ids": [
    "P_TREAT_EACH_INPUT_AS_LOGIC_1",
    "P_INTERPRET_VD1_VD6_AS_AN_UNSIGNED",
    "P_SCALE_THE_DECODED_CODE_BY_VREF",
    "P_MAP_ALL_ZERO_INPUT_TO_0",
    "P_MAP_ALL_ONES_INPUT_TO_VREF"
  ],
  "public_visible": false,
  "schema_version": "v4-harness-profile-v1",
  "simulatorOptions": {
    "evas_profile": "balanced"
  }
}
