{
  "corners": [],
  "deck_overrides": {
    "body_lines": [
      "Vinp (vinp 0) vsource type=pwl wave=[0 0 8n 0 8.1n 0.9 12n 0.9 12.1n 0 29n 0 29.1n 0.9 33n 0.9 33.1n 0 60n 0]",
      "Vinn (vinn 0) vsource type=pwl wave=[0 0 10n 0 10.1n 0.9 14n 0.9 14.1n 0 27n 0 27.1n 0.9 31n 0.9 31.1n 0 60n 0]",
      "",
      "XDUT (clk vinp vinn vout) time_diff_detector vdd=0.9 scale=1e9 tr=1p",
      ""
    ]
  },
  "deterministic_seed": 0,
  "generated_from": {
    "script": "render_v4_harness.py",
    "version": "v4-harness-renderer-v1"
  },
  "harness_spec_sha256": "75d7bee47e345ecff7e535173a54920df4fb9d7b969cc3e64cd494eb2c3085d4",
  "parameters": {
    "maxstep": "200p",
    "stop_time": "100n"
  },
  "profile_name": "feedback",
  "property_ids": [
    "P_FIRST_EDGE_CAPTURE",
    "P_PREVIOUS_WINDOW_REPORT",
    "P_SIGNED_DIFFERENCE",
    "P_OUTPUT_CLIP",
    "P_WINDOW_REARM",
    "P_OUTPUT_TRANSITION"
  ],
  "public_visible": true,
  "schema_version": "v4-harness-profile-v1",
  "simulatorOptions": {
    "evas_profile": "balanced"
  }
}
