{
  "corners": [],
  "deck_overrides": {},
  "deterministic_seed": 0,
  "generated_from": {
    "script": "render_v4_harness.py",
    "version": "v4-harness-renderer-v1"
  },
  "harness_spec_sha256": "71788ef330cd13c61f61ce2a1ab68202c9feeb5959e43bfa646bb04ae20b2816",
  "parameters": {},
  "profile_name": "score",
  "property_ids": [
    "P_SHARED_272_DENOMINATOR",
    "P_SEVEN_BIT_OUTPUT",
    "P_SEVEN_HALF_BIT_OUTPUT",
    "P_EIGHT_BIT_OUTPUT"
  ],
  "public_visible": false,
  "schema_version": "v4-harness-profile-v1",
  "simulatorOptions": {}
}
