{
  "corners": [],
  "deck_overrides": {
    "analyses": [
      "tran tran stop=55n maxstep=50p"
    ]
  },
  "deterministic_seed": 0,
  "generated_from": {
    "script": "render_v4_harness.py",
    "version": "v4-harness-renderer-v1"
  },
  "harness_spec_sha256": "495029f47913bf835a52910ee7a5a869606b5b6bc81d11125dee35ea71f66641",
  "parameters": {
    "maxstep": "100p",
    "stop_time": "100n"
  },
  "profile_name": "score",
  "property_ids": [
    "P_INITIAL_RESET_LOW",
    "P_FALLING_EDGE_RESET_LOW",
    "P_POSITIVE_DIFFERENTIAL_DECISION",
    "P_NEGATIVE_DIFFERENTIAL_DECISION",
    "P_EQUAL_INPUT_RESET_STATE",
    "P_LATCHED_HOLD_AND_TIMING"
  ],
  "public_visible": false,
  "schema_version": "v4-harness-profile-v1",
  "simulatorOptions": {}
}
