{
  "corners": [],
  "deck_overrides": {},
  "deterministic_seed": 0,
  "generated_from": {
    "script": "render_v4_harness.py",
    "version": "v4-harness-renderer-v1"
  },
  "harness_spec_sha256": "9f4537750880125dc76c97ddc1b5a7e499bbff39ecdfe765aa1356c8c2d332cc",
  "parameters": {},
  "profile_name": "score",
  "property_ids": [
    "P_PREFIX_CODE",
    "P_ORDERED_ACTIVATION",
    "P_UNIFORM_SEGMENTS",
    "P_INPUT_CLIPPING",
    "P_OUTPUT_LEVELS"
  ],
  "public_visible": false,
  "schema_version": "v4-harness-profile-v1",
  "simulatorOptions": {}
}
